{
  "schema_version": "native-ai-1.0",
  "track_id": "NATIVE-001",
  "version": "1.0.0",
  "canonical_status": "CANONICAL",
  "default_projection_fields": [
    "id",
    "title",
    "engineering_question",
    "native_fact",
    "scope",
    "ai_coding_impact",
    "common_ai_failure",
    "recommended_reasoning",
    "does_not_mean",
    "evidence_strength"
  ],
  "default_core_cap": 5,
  "evidence_class_contract": {
    "NSF": "Snapshot-scoped native Lua source fact.",
    "RV": "Only explicitly scoped historical runtime observation, never whole-entry promotion.",
    "EI": "Engineering inference; separate from native fact.",
    "REC": "Conditional recommendation, not Klei best practice.",
    "UNK": "Unknown / engine boundary; no guessed engine mechanism.",
    "KNOWLEDGE_PRODUCT_EVALUATION": "Pilot coding-product evaluation; never RV."
  },
  "entries": [
    {
      "id": "AI-N001-01",
      "title": "账号、连接与运行实体分别建模",
      "engineering_question": "跨重连玩家进度用什么标识？",
      "native_fact": {
        "claim_type": "NSF",
        "statement": "userid由Network/owner链写回实体；GUID/Ents索引当前runtime实体，AllPlayers是当前进程实例列表；ClientTable不是已加载实体列表，ThePlayer不是账号注册表。"
      },
      "scope": {
        "snapshot_id": "KLEI-INSTALLED-20261004-f8d7cff2",
        "version": "756039 / installed 2026-10-04, not rechecked this round",
        "sides": "仅限已查源码的各自端别和分支，不推为所有端一致",
        "runtime_environments": "仅引用既有单账号Listen/Dedicated Remote场景的局部范围，不构成整条知识的Runtime验证",
        "exclusions": [
          "native内部总序/持久化保证",
          "多shard全链",
          "全部角色/插件",
          "当前安装是否仍为该快照"
        ]
      },
      "ai_coding_impact": {
        "claim_type": "REC / EI",
        "decisions": [
          "将长期进度键与当前实体引用分开；账号值尚未建立时先延后账号绑定。",
          "重连后重新取得当前实体，不把旧GUID、classified GUID或table引用写作永久玩家ID。"
        ]
      },
      "common_ai_failure": [
        "用GUID作为永久玩家身份。",
        "从ClientTable记录存在推断player已创建或已加载。"
      ],
      "recommended_reasoning": {
        "claim_type": "REC",
        "steps": [
          "先明确数据寿命，再选择已建立的账号关联或当次实体引用。",
          "账号关联不是在线/认证/跨shard实体连续性的证明。"
        ]
      },
      "does_not_mean": [
        "userid保证同一Lua对象持续存在",
        "GUID跨进程、跨shard稳定或永不复用"
      ],
      "evidence_strength": {
        "native_fact": "DIRECT_STATIC_SOURCE_IN_EXISTING_SNAPSHOT",
        "engineering_recommendation": "BOUNDED_REASONING_FROM_SOURCE_AND_TASK_REQUIREMENTS",
        "effect_on_AI_quality": "PER_ENTRY_CAUSAL_EFFECT_NOT_ESTABLISHED"
      },
      "typical_mod_tasks": [
        "player progression",
        "cross-session identity",
        "reconnect bug"
      ],
      "retrieval_triggers": [
        "userid",
        "GUID",
        "Ents",
        "AllPlayers",
        "ClientTable",
        "玩家身份"
      ],
      "knowledge_role": "CORE_AI_ENGINEERING",
      "coverage_status": "BOUNDED_PLAYER_LIFECYCLE",
      "related_native_facts": [
        "AI-N001-08",
        "AI-N001-12"
      ],
      "typed_relations": [
        {
          "type": "related",
          "target": "AI-N001-08"
        },
        {
          "type": "related",
          "target": "AI-N001-12"
        }
      ],
      "research_evidence_refs": [
        "AI-N001-01"
      ]
    },
    {
      "id": "AI-N001-02",
      "title": "权威端、本地玩家与专服是三个判断",
      "engineering_question": "游戏状态、客户端显示和本地输入应在哪个端初始化？",
      "native_fact": {
        "claim_type": "NSF",
        "statement": "MakePlayerCharacter共享构造在SetPristine后对remote返回；master尾部另行初始化。OnSetOwner按master或ThePlayer条件建立控制资源，HUD在本地玩家分支；原版握手对Host、Dedicated、Remote采用不同分派。"
      },
      "scope": {
        "snapshot_id": "KLEI-INSTALLED-20261004-f8d7cff2",
        "version": "756039 / installed 2026-10-04, not rechecked this round",
        "sides": "仅限已查源码的各自端别和分支，不推为所有端一致",
        "runtime_environments": "仅引用既有单账号Listen/Dedicated Remote场景的局部范围，不构成整条知识的Runtime验证",
        "exclusions": [
          "native内部总序/持久化保证",
          "多shard全链",
          "全部角色/插件",
          "当前安装是否仍为该快照"
        ]
      },
      "ai_coding_impact": {
        "claim_type": "REC / EI",
        "decisions": [
          "把权威游戏组件/状态写入放在对应master/server路径；客户端使用已验证的复制接口。",
          "仅在本地玩家上下文建立HUD/输入；分别审查authority、locality、dedicated，不以ismastershard代替这三个条件。"
        ]
      },
      "common_ai_failure": [
        "Remote Client直接访问server-only component。",
        "将not dedicated当作本地玩家条件。",
        "Host正常即宣布Remote正确。"
      ],
      "recommended_reasoning": {
        "claim_type": "REC",
        "steps": [
          "为每项读写列出owner、producer、consumer和端别。",
          "Host同时拥有多个角色，不能掩盖remote缺少权威组件的分支。"
        ]
      },
      "does_not_mean": [
        "所有组件在所有端都存在",
        "服务器只能用ThePlayer取得玩家",
        "本轮重新验证了多人正确性"
      ],
      "evidence_strength": {
        "native_fact": "DIRECT_STATIC_SOURCE_IN_EXISTING_SNAPSHOT",
        "engineering_recommendation": "BOUNDED_REASONING_FROM_SOURCE_AND_TASK_REQUIREMENTS",
        "effect_on_AI_quality": "PER_ENTRY_CAUSAL_EFFECT_NOT_ESTABLISHED"
      },
      "typical_mod_tasks": [
        "server/client player initialization",
        "HUD depending on player data",
        "Host works / Remote fails"
      ],
      "retrieval_triggers": [
        "ismastersim",
        "IsDedicated",
        "ThePlayer",
        "server-only",
        "Host",
        "Remote"
      ],
      "knowledge_role": "CORE_AI_ENGINEERING",
      "coverage_status": "BOUNDED_PLAYER_LIFECYCLE",
      "related_native_facts": [
        "AI-N001-03",
        "AI-N001-04",
        "AI-N001-10"
      ],
      "typed_relations": [
        {
          "type": "related",
          "target": "AI-N001-03"
        },
        {
          "type": "related",
          "target": "AI-N001-04"
        },
        {
          "type": "related",
          "target": "AI-N001-10"
        }
      ],
      "research_evidence_refs": [
        "AI-N001-02"
      ]
    },
    {
      "id": "AI-N001-03",
      "title": "Readiness是具体依赖的谓词",
      "engineering_question": "初始化可以依赖playeractivated或READY吗？",
      "native_fact": {
        "claim_type": "NSF",
        "statement": "玩家早期已经进入AllPlayers；local activation、entity/world playeractivated、Client READY、Server READY、控制器和loading protection具有不同条件。READY处理有技能树/设置协议的特定作用，不能推得全部Mod数据、复制值或输入可用。"
      },
      "scope": {
        "snapshot_id": "KLEI-INSTALLED-20261004-f8d7cff2",
        "version": "756039 / installed 2026-10-04, not rechecked this round",
        "sides": "仅限已查源码的各自端别和分支，不推为所有端一致",
        "runtime_environments": "仅引用既有单账号Listen/Dedicated Remote场景的局部范围，不构成整条知识的Runtime验证",
        "exclusions": [
          "native内部总序/持久化保证",
          "多shard全链",
          "全部角色/插件",
          "当前安装是否仍为该快照"
        ]
      },
      "ai_coding_impact": {
        "claim_type": "REC / EI",
        "decisions": [
          "为具体工作检查所需实体、组件/复制视图、账号、HUD或加载数据；不维护一个万能PlayerReady旗标替代这些条件。",
          "只在需要原版技能树协议时使用相应READY语义；事件payload按entity/world producer分别处理。"
        ]
      },
      "common_ai_failure": [
        "Entity Exists就开始读取全部组件。",
        "READY后无条件操作所有HUD或认为控制器已启用。",
        "将两个playeractivated事件都按相同player参数处理。"
      ],
      "recommended_reasoning": {
        "claim_type": "REC",
        "steps": [
          "从消费点反推最小依赖；静态延迟一帧不是数据已到达的证明。",
          "初始化失败/移除时终止属于自己的等待，避免无限poll。"
        ]
      },
      "does_not_mean": [
        "存在一个适用于所有Mod的通用ready点",
        "Client READY与Server READY或复制freshness等价"
      ],
      "evidence_strength": {
        "native_fact": "DIRECT_STATIC_SOURCE_IN_EXISTING_SNAPSHOT",
        "engineering_recommendation": "BOUNDED_REASONING_FROM_SOURCE_AND_TASK_REQUIREMENTS",
        "effect_on_AI_quality": "PER_ENTRY_CAUSAL_EFFECT_NOT_ESTABLISHED"
      },
      "typical_mod_tasks": [
        "persistent player ability",
        "server/client player initialization",
        "HUD depending on player data"
      ],
      "retrieval_triggers": [
        "playeractivated",
        "READY",
        "readiness",
        "初始化时机",
        "loading protection"
      ],
      "knowledge_role": "CORE_AI_ENGINEERING",
      "coverage_status": "BOUNDED_PLAYER_LIFECYCLE",
      "related_native_facts": [
        "AI-N001-02",
        "AI-N001-10"
      ],
      "typed_relations": [
        {
          "type": "related",
          "target": "AI-N001-02"
        },
        {
          "type": "related",
          "target": "AI-N001-10"
        }
      ],
      "research_evidence_refs": [
        "AI-N001-03"
      ]
    },
    {
      "id": "AI-N001-04",
      "title": "构造阶段与Mod PostInit时点分开",
      "engineering_question": "在哪里安装角色逻辑和生命周期回调？",
      "native_fact": {
        "claim_type": "NSF",
        "statement": "common_postinit早于SetPristine与remote返回；master_postinit之后捕获角色OnSave/OnPreLoad/OnLoad/OnNewSpawn并装common wrappers。ms_playerspawn在构造内部发生，而外围Mod prefab postinit在prefab.fn返回后。"
      },
      "scope": {
        "snapshot_id": "KLEI-INSTALLED-20261004-f8d7cff2",
        "version": "756039 / installed 2026-10-04, not rechecked this round",
        "sides": "仅限已查源码的各自端别和分支，不推为所有端一致",
        "runtime_environments": "仅引用既有单账号Listen/Dedicated Remote场景的局部范围，不构成整条知识的Runtime验证",
        "exclusions": [
          "native内部总序/持久化保证",
          "多shard全链",
          "全部角色/插件",
          "当前安装是否仍为该快照"
        ]
      },
      "ai_coding_impact": {
        "claim_type": "REC / EI",
        "decisions": [
          "在角色factory参数与Mod外部PostInit之间选择真实适用入口；不把ms_playerspawn当最终Mod初始化完成信号。",
          "添加Player组件时遵守端别；覆盖既有生命周期字段前确认当前wrapper契约并保留原逻辑。"
        ]
      },
      "common_ai_failure": [
        "common_postinit里假定最终userid已经写入。",
        "外部PostInit直接覆盖OnLoad，丢掉角色/common包装逻辑。"
      ],
      "recommended_reasoning": {
        "claim_type": "REC",
        "steps": [
          "先区分自己的角色factory与给其他玩家追加组件这两种任务。",
          "组件承担独立状态时优先以自己的组件契约组织，而非不必要地替换玩家整体回调；这是REC。"
        ]
      },
      "does_not_mean": [
        "ms_playerspawn表示落点、读档和local HUD全部完成",
        "原版wrapper细节就是普遍最佳实践"
      ],
      "evidence_strength": {